<?xml version="1.0" encoding="UTF-8" standalone="yes"?>
<lionengine:circuits xmlns:lionengine="http://lionengine.b3dgs.com/xsd/10" xmlns:xsi="http://www.w3.org/2001/XMLSchema-instance" xsi:schemaLocation="http://lionengine.b3dgs.com/xsd/10 http://lionengine.b3dgs.com/xsd/10/game/feature/tile/map/transition/circuit/tileCircuits.xsd">
    <lionengine:circuit in="road" out="grass" type="T3J_RIGHT">
        <lionengine:tile number="17"/>
    </lionengine:circuit>
    <lionengine:circuit in="road" out="road" type="MIDDLE">
        <lionengine:tile number="16"/>
    </lionengine:circuit>
    <lionengine:circuit in="road" out="grass" type="ANGLE_TOP_RIGHT">
        <lionengine:tile number="5"/>
    </lionengine:circuit>
    <lionengine:circuit in="road" out="grass" type="T3J_BOTTOM">
        <lionengine:tile number="22"/>
    </lionengine:circuit>
    <lionengine:circuit in="road" out="grass" type="VERTICAL">
        <lionengine:tile number="9"/>
    </lionengine:circuit>
    <lionengine:circuit in="road" out="grass" type="T3J_LEFT">
        <lionengine:tile number="14"/>
    </lionengine:circuit>
    <lionengine:circuit in="road" out="grass" type="ANGLE_TOP_LEFT">
        <lionengine:tile number="1"/>
    </lionengine:circuit>
    <lionengine:circuit in="road" out="grass" type="ANGLE_BOTTOM_RIGHT">
        <lionengine:tile number="23"/>
    </lionengine:circuit>
    <lionengine:circuit in="road" out="grass" type="TOP">
        <lionengine:tile number="3"/>
    </lionengine:circuit>
    <lionengine:circuit in="road" out="grass" type="LEFT">
        <lionengine:tile number="4"/>
    </lionengine:circuit>
    <lionengine:circuit in="road" out="grass" type="T3J_TOP">
        <lionengine:tile number="10"/>
    </lionengine:circuit>
    <lionengine:circuit in="road" out="grass" type="HORIZONTAL">
        <lionengine:tile number="15"/>
    </lionengine:circuit>
    <lionengine:circuit in="road" out="grass" type="ANGLE_BOTTOM_LEFT">
        <lionengine:tile number="21"/>
    </lionengine:circuit>
    <lionengine:circuit in="road" out="grass" type="RIGHT">
        <lionengine:tile number="2"/>
    </lionengine:circuit>
    <lionengine:circuit in="road" out="grass" type="BOTTOM">
        <lionengine:tile number="24"/>
    </lionengine:circuit>
</lionengine:circuits>
